[I 2024-01-07 10:43:51,486] A new study created in memory with name: no-name-0e63f076-4d58-45a3-9d90-8edc21c9104e
[I 2024-01-07 11:22:25,160] Trial 0 finished with value: 0.7064776939256651 and parameters: {'n_layers': 3, 'n_units_l0': 70, 'n_units_l1': 24, 'n_units_l2': 36, 'optimizer': 'Adam', 'lr': 0.06534189922496905, 'batch_size': 128}. Best is trial 0 with value: 0.7064776939256651.
[I 2024-01-07 12:01:03,828] Trial 1 finished with value: 0.7419594132577003 and parameters: {'n_layers': 4, 'n_units_l0': 120, 'n_units_l1': 50, 'n_units_l2': 96, 'n_units_l3': 126, 'optimizer': 'Adam', 'lr': 0.0038609075502170674, 'batch_size': 256}. Best is trial 1 with value: 0.7419594132577003.
[I 2024-01-07 14:16:17,553] Trial 2 finished with value: 0.7286612274878537 and parameters: {'n_layers': 1, 'n_units_l0': 61, 'optimizer': 'Adam', 'lr': 0.00012021194428805873, 'batch_size': 256}. Best is trial 1 with value: 0.7419594132577003.
[I 2024-01-07 16:33:49,033] Trial 3 finished with value: 0.7370757318563965 and parameters: {'n_layers': 1, 'n_units_l0': 69, 'optimizer': 'SGD', 'lr': 0.00018648123647632724, 'batch_size': 64}. Best is trial 1 with value: 0.7419594132577003.
[I 2024-01-07 16:55:35,868] Trial 4 finished with value: 0.6950926964452168 and parameters: {'n_layers': 3, 'n_units_l0': 62, 'n_units_l1': 116, 'n_units_l2': 122, 'optimizer': 'SGD', 'lr': 0.05598932151559006, 'batch_size': 64}. Best is trial 1 with value: 0.7419594132577003.
[I 2024-01-07 19:20:48,987] Trial 5 finished with value: 0.7467413701837802 and parameters: {'n_layers': 1, 'n_units_l0': 101, 'optimizer': 'SGD', 'lr': 0.0005737343821558807, 'batch_size': 256}. Best is trial 5 with value: 0.7467413701837802.
[I 2024-01-07 20:30:23,985] Trial 6 finished with value: 0.7455013434941131 and parameters: {'n_layers': 1, 'n_units_l0': 122, 'optimizer': 'Adam', 'lr': 0.0008683004481941826, 'batch_size': 64}. Best is trial 5 with value: 0.7467413701837802.
[I 2024-01-07 23:05:22,895] Trial 7 finished with value: 0.7449387742557504 and parameters: {'n_layers': 3, 'n_units_l0': 70, 'n_units_l1': 116, 'n_units_l2': 61, 'optimizer': 'Adam', 'lr': 0.0002441989396386181, 'batch_size': 256}. Best is trial 5 with value: 0.7467413701837802.
Number of finished trials:  8
Best trial:
  NDCG@5: 0.7467413701837802
  Params: 
    n_layers: 1
    n_units_l0: 101
    optimizer: SGD
    lr: 0.0005737343821558807
    batch_size: 256
