[I 2024-01-12 16:56:30,731] A new study created in memory with name: no-name-b0fcc39f-9273-40cc-9444-22092a8c52f3
[I 2024-01-12 18:33:38,596] Trial 0 finished with value: 0.8554816014570209 and parameters: {'n_layers': 1, 'n_units_l0': 98, 'optimizer': 'Adam', 'lr': 0.0017587162317142559, 'batch_size': 256}. Best is trial 0 with value: 0.8554816014570209.
[I 2024-01-12 20:29:32,438] Trial 1 finished with value: 0.8550154742152113 and parameters: {'n_layers': 2, 'n_units_l0': 49, 'n_units_l1': 94, 'optimizer': 'Adam', 'lr': 0.00032215486096411484, 'batch_size': 64}. Best is trial 0 with value: 0.8554816014570209.
[I 2024-01-12 21:02:20,435] Trial 2 finished with value: 0.8433880765358198 and parameters: {'n_layers': 2, 'n_units_l0': 112, 'n_units_l1': 10, 'optimizer': 'Adam', 'lr': 0.00647425021984536, 'batch_size': 128}. Best is trial 0 with value: 0.8554816014570209.
[I 2024-01-12 22:26:33,775] Trial 3 finished with value: 0.8566922455570231 and parameters: {'n_layers': 3, 'n_units_l0': 74, 'n_units_l1': 55, 'n_units_l2': 65, 'optimizer': 'Adam', 'lr': 0.0019137229854865648, 'batch_size': 512}. Best is trial 3 with value: 0.8566922455570231.
[I 2024-01-12 22:58:29,804] Trial 4 finished with value: 0.8315466747139649 and parameters: {'n_layers': 2, 'n_units_l0': 42, 'n_units_l1': 111, 'optimizer': 'Adam', 'lr': 0.022142268482637156, 'batch_size': 128}. Best is trial 3 with value: 0.8566922455570231.
[I 2024-01-13 01:14:33,289] Trial 5 finished with value: 0.8574052525007126 and parameters: {'n_layers': 2, 'n_units_l0': 34, 'n_units_l1': 36, 'optimizer': 'Adam', 'lr': 0.0004376499888535596, 'batch_size': 512}. Best is trial 5 with value: 0.8574052525007126.
[I 2024-01-13 01:32:10,319] Trial 6 finished with value: 0.8405348747892408 and parameters: {'n_layers': 1, 'n_units_l0': 51, 'optimizer': 'Adam', 'lr': 0.01634832279662921, 'batch_size': 256}. Best is trial 5 with value: 0.8574052525007126.
[I 2024-01-13 01:51:26,180] Trial 7 finished with value: 0.8240341041441925 and parameters: {'n_layers': 3, 'n_units_l0': 91, 'n_units_l1': 93, 'n_units_l2': 5, 'optimizer': 'Adam', 'lr': 0.06442189200867045, 'batch_size': 512}. Best is trial 5 with value: 0.8574052525007126.
[I 2024-01-13 03:35:40,592] Trial 8 finished with value: 0.856047640442418 and parameters: {'n_layers': 2, 'n_units_l0': 97, 'n_units_l1': 79, 'optimizer': 'SGD', 'lr': 0.0003476514036906042, 'batch_size': 256}. Best is trial 5 with value: 0.8574052525007126.
[I 2024-01-13 05:15:46,496] Trial 9 finished with value: 0.8545020420044142 and parameters: {'n_layers': 3, 'n_units_l0': 96, 'n_units_l1': 111, 'n_units_l2': 110, 'optimizer': 'Adam', 'lr': 0.0006343549533218922, 'batch_size': 64}. Best is trial 5 with value: 0.8574052525007126.
Number of finished trials:  10
Best trial:
  NDCG@50: 0.8574052525007126
  Params: 
    n_layers: 2
    n_units_l0: 34
    n_units_l1: 36
    optimizer: Adam
    lr: 0.0004376499888535596
    batch_size: 512
