[I 2024-01-08 22:39:23,020] A new study created in memory with name: no-name-61af5a84-bea8-45e0-866e-f3a049ee5a54
[I 2024-01-09 00:35:47,163] Trial 0 finished with value: 0.568944602246895 and parameters: {'n_layers': 2, 'n_units_l0': 72, 'n_units_l1': 21, 'optimizer': 'Adam', 'lr': 0.06085686880647488, 'batch_size': 512}. Best is trial 0 with value: 0.568944602246895.
[I 2024-01-09 04:04:59,679] Trial 1 finished with value: 0.32875498616608473 and parameters: {'n_layers': 3, 'n_units_l0': 80, 'n_units_l1': 102, 'n_units_l2': 26, 'optimizer': 'SGD', 'lr': 0.04153766883452959, 'batch_size': 512}. Best is trial 0 with value: 0.568944602246895.
[I 2024-01-09 06:20:53,452] Trial 2 finished with value: 0.5645813438799642 and parameters: {'n_layers': 1, 'n_units_l0': 84, 'optimizer': 'SGD', 'lr': 0.01293388668336241, 'batch_size': 256}. Best is trial 0 with value: 0.568944602246895.
[I 2024-01-09 08:55:00,582] Trial 3 finished with value: 0.5305221371154187 and parameters: {'n_layers': 1, 'n_units_l0': 66, 'optimizer': 'SGD', 'lr': 0.036161025800184134, 'batch_size': 128}. Best is trial 0 with value: 0.568944602246895.
[I 2024-01-09 20:29:43,814] Trial 4 finished with value: 0.5785541041291865 and parameters: {'n_layers': 2, 'n_units_l0': 31, 'n_units_l1': 66, 'optimizer': 'Adam', 'lr': 0.0003388841878070204, 'batch_size': 64}. Best is trial 4 with value: 0.5785541041291865.
Number of finished trials:  5
Best trial:
  NDCG@5: 0.5785541041291865
  Params: 
    n_layers: 2
    n_units_l0: 31
    n_units_l1: 66
    optimizer: Adam
    lr: 0.0003388841878070204
    batch_size: 64
