[I 2024-01-13 18:51:19,224] A new study created in memory with name: no-name-e4521315-35c0-4798-8e6f-c48257e0ae63
[I 2024-01-14 01:24:58,858] Trial 0 finished with value: 0.6514953577713418 and parameters: {'n_layers': 1, 'n_units_l0': 85, 'optimizer': 'Adam', 'lr': 0.0006312074316293967, 'batch_size': 512}. Best is trial 0 with value: 0.6514953577713418.
[I 2024-01-14 03:07:44,102] Trial 1 finished with value: 0.6445513680621595 and parameters: {'n_layers': 2, 'n_units_l0': 13, 'n_units_l1': 57, 'optimizer': 'SGD', 'lr': 0.0007482442257266866, 'batch_size': 64}. Best is trial 0 with value: 0.6514953577713418.
[I 2024-01-14 04:22:16,077] Trial 2 finished with value: 0.6427085610135133 and parameters: {'n_layers': 4, 'n_units_l0': 68, 'n_units_l1': 69, 'n_units_l2': 124, 'n_units_l3': 21, 'optimizer': 'Adam', 'lr': 0.013640211766739773, 'batch_size': 128}. Best is trial 0 with value: 0.6514953577713418.
[I 2024-01-14 08:02:49,945] Trial 3 finished with value: 0.6537804183877847 and parameters: {'n_layers': 3, 'n_units_l0': 64, 'n_units_l1': 14, 'n_units_l2': 83, 'optimizer': 'Adam', 'lr': 0.0015432537515840507, 'batch_size': 512}. Best is trial 3 with value: 0.6537804183877847.
[I 2024-01-14 10:17:29,414] Trial 4 finished with value: 0.6450704128100858 and parameters: {'n_layers': 1, 'n_units_l0': 115, 'optimizer': 'SGD', 'lr': 0.002546691132531382, 'batch_size': 256}. Best is trial 3 with value: 0.6537804183877847.
[I 2024-01-14 17:50:22,318] Trial 5 finished with value: 0.6535109785311699 and parameters: {'n_layers': 1, 'n_units_l0': 66, 'optimizer': 'SGD', 'lr': 0.00011286185911881797, 'batch_size': 512}. Best is trial 3 with value: 0.6537804183877847.
[I 2024-01-14 18:50:19,762] Trial 6 finished with value: 0.5686242229067784 and parameters: {'n_layers': 2, 'n_units_l0': 65, 'n_units_l1': 108, 'optimizer': 'SGD', 'lr': 0.07510263535794706, 'batch_size': 64}. Best is trial 3 with value: 0.6537804183877847.
[I 2024-01-14 19:47:52,630] Trial 7 finished with value: 0.62633497419626 and parameters: {'n_layers': 3, 'n_units_l0': 88, 'n_units_l1': 89, 'n_units_l2': 89, 'optimizer': 'SGD', 'lr': 0.00728397702204352, 'batch_size': 256}. Best is trial 3 with value: 0.6537804183877847.
[I 2024-01-14 21:27:57,312] Trial 8 finished with value: 0.6466454271298715 and parameters: {'n_layers': 2, 'n_units_l0': 82, 'n_units_l1': 117, 'optimizer': 'SGD', 'lr': 0.0010439552888566056, 'batch_size': 256}. Best is trial 3 with value: 0.6537804183877847.
[I 2024-01-15 01:53:56,553] Trial 9 finished with value: 0.6529170307559108 and parameters: {'n_layers': 2, 'n_units_l0': 49, 'n_units_l1': 59, 'optimizer': 'SGD', 'lr': 0.00029070398523972255, 'batch_size': 128}. Best is trial 3 with value: 0.6537804183877847.
[I 2024-01-15 05:16:29,166] Trial 10 finished with value: 0.6522600591055431 and parameters: {'n_layers': 4, 'n_units_l0': 25, 'n_units_l1': 7, 'n_units_l2': 19, 'n_units_l3': 120, 'optimizer': 'Adam', 'lr': 0.002594196956218403, 'batch_size': 512}. Best is trial 3 with value: 0.6537804183877847.
[I 2024-01-15 12:57:47,815] Trial 11 finished with value: 0.6462254884812872 and parameters: {'n_layers': 3, 'n_units_l0': 36, 'n_units_l1': 4, 'n_units_l2': 58, 'optimizer': 'Adam', 'lr': 0.00011336125602127264, 'batch_size': 512}. Best is trial 3 with value: 0.6537804183877847.
Number of finished trials:  12
Best trial:
  NDCG@100: 0.6537804183877847
  Params: 
    n_layers: 3
    n_units_l0: 64
    n_units_l1: 14
    n_units_l2: 83
    optimizer: Adam
    lr: 0.0015432537515840507
    batch_size: 512
