[I 2024-01-07 10:43:51,448] A new study created in memory with name: no-name-f75283e2-3dc1-41b5-8d37-cf003196914b
[I 2024-01-07 11:55:36,842] Trial 0 finished with value: 0.7441000695855214 and parameters: {'n_layers': 2, 'n_units_l0': 115, 'n_units_l1': 102, 'optimizer': 'SGD', 'lr': 0.0008984661106906121, 'batch_size': 128}. Best is trial 0 with value: 0.7441000695855214.
[I 2024-01-07 12:34:19,876] Trial 1 finished with value: 0.718690284709815 and parameters: {'n_layers': 4, 'n_units_l0': 10, 'n_units_l1': 47, 'n_units_l2': 55, 'n_units_l3': 48, 'optimizer': 'SGD', 'lr': 0.008475233905181118, 'batch_size': 128}. Best is trial 0 with value: 0.7441000695855214.
[I 2024-01-07 13:04:03,874] Trial 2 finished with value: 0.726714674319788 and parameters: {'n_layers': 4, 'n_units_l0': 31, 'n_units_l1': 88, 'n_units_l2': 27, 'n_units_l3': 6, 'optimizer': 'Adam', 'lr': 0.02918135450770502, 'batch_size': 256}. Best is trial 0 with value: 0.7441000695855214.
[I 2024-01-07 15:19:21,918] Trial 3 finished with value: 0.7393942095421937 and parameters: {'n_layers': 3, 'n_units_l0': 9, 'n_units_l1': 101, 'n_units_l2': 17, 'optimizer': 'Adam', 'lr': 0.0007049893307130757, 'batch_size': 512}. Best is trial 0 with value: 0.7441000695855214.
[I 2024-01-07 17:25:08,701] Trial 4 finished with value: 0.7359747639165147 and parameters: {'n_layers': 1, 'n_units_l0': 26, 'optimizer': 'SGD', 'lr': 0.00013063641857524654, 'batch_size': 512}. Best is trial 0 with value: 0.7441000695855214.
[I 2024-01-07 19:55:40,161] Trial 5 finished with value: 0.7453266645353316 and parameters: {'n_layers': 3, 'n_units_l0': 64, 'n_units_l1': 97, 'n_units_l2': 12, 'optimizer': 'SGD', 'lr': 0.00012408665737730022, 'batch_size': 128}. Best is trial 5 with value: 0.7453266645353316.
[I 2024-01-07 20:14:43,597] Trial 6 finished with value: 0.7206332527071942 and parameters: {'n_layers': 4, 'n_units_l0': 114, 'n_units_l1': 84, 'n_units_l2': 26, 'n_units_l3': 107, 'optimizer': 'SGD', 'lr': 0.02266501624985648, 'batch_size': 64}. Best is trial 5 with value: 0.7453266645353316.
[I 2024-01-07 21:16:18,813] Trial 7 finished with value: 0.7443986814524064 and parameters: {'n_layers': 3, 'n_units_l0': 78, 'n_units_l1': 100, 'n_units_l2': 51, 'optimizer': 'SGD', 'lr': 0.0005550939821905625, 'batch_size': 64}. Best is trial 5 with value: 0.7453266645353316.
[I 2024-01-07 22:53:14,914] Trial 8 finished with value: 0.7449459320415819 and parameters: {'n_layers': 4, 'n_units_l0': 70, 'n_units_l1': 56, 'n_units_l2': 114, 'n_units_l3': 50, 'optimizer': 'SGD', 'lr': 0.00043121342253184345, 'batch_size': 64}. Best is trial 5 with value: 0.7453266645353316.
Number of finished trials:  9
Best trial:
  NDCG@5: 0.7453266645353316
  Params: 
    n_layers: 3
    n_units_l0: 64
    n_units_l1: 97
    n_units_l2: 12
    optimizer: SGD
    lr: 0.00012408665737730022
    batch_size: 128
