[I 2024-01-07 00:41:26,178] A new study created in memory with name: no-name-a50f29f3-6ab1-47d4-b66e-bbb6d8a56ce2
[I 2024-01-07 03:43:21,719] Trial 0 finished with value: 0.7343343398925096 and parameters: {'n_layers': 3, 'n_units_l0': 125, 'n_units_l1': 40, 'n_units_l2': 39, 'optimizer': 'SGD', 'lr': 5.5447090776890344e-05, 'batch_size': 128}. Best is trial 0 with value: 0.7343343398925096.
[I 2024-01-07 06:38:46,126] Trial 1 finished with value: 0.7457040505233906 and parameters: {'n_layers': 3, 'n_units_l0': 97, 'n_units_l1': 101, 'n_units_l2': 67, 'optimizer': 'RMSprop', 'lr': 0.0006202315382740154, 'batch_size': 512}. Best is trial 1 with value: 0.7457040505233906.
[I 2024-01-07 07:15:29,352] Trial 2 finished with value: 0.6652034011936887 and parameters: {'n_layers': 3, 'n_units_l0': 24, 'n_units_l1': 84, 'n_units_l2': 47, 'optimizer': 'SGD', 'lr': 5.4180533119995123e-05, 'batch_size': 512}. Best is trial 1 with value: 0.7457040505233906.
[I 2024-01-07 08:45:59,186] Trial 3 finished with value: 0.7470588957231956 and parameters: {'n_layers': 2, 'n_units_l0': 95, 'n_units_l1': 85, 'optimizer': 'RMSprop', 'lr': 0.000937074113628203, 'batch_size': 256}. Best is trial 3 with value: 0.7470588957231956.
[I 2024-01-07 09:39:12,967] Trial 4 finished with value: 0.7345814449803418 and parameters: {'n_layers': 3, 'n_units_l0': 52, 'n_units_l1': 79, 'n_units_l2': 44, 'optimizer': 'RMSprop', 'lr': 0.005749007778857062, 'batch_size': 64}. Best is trial 3 with value: 0.7470588957231956.
slurmstepd: error: *** JOB 799772 ON ilps-cn001 CANCELLED AT 2024-01-07T10:15:24 ***
