[I 2024-01-07 10:43:51,469] A new study created in memory with name: no-name-35d17908-d2ae-4e88-97f6-e79ae1b6bb7e
[I 2024-01-07 11:26:11,759] Trial 0 finished with value: 0.7406021191091197 and parameters: {'n_layers': 2, 'n_units_l0': 80, 'n_units_l1': 101, 'optimizer': 'SGD', 'lr': 0.0033975528347577146, 'batch_size': 128}. Best is trial 0 with value: 0.7406021191091197.
[I 2024-01-07 12:26:13,540] Trial 1 finished with value: 0.7027541708692697 and parameters: {'n_layers': 1, 'n_units_l0': 112, 'optimizer': 'SGD', 'lr': 0.07950269216781954, 'batch_size': 64}. Best is trial 0 with value: 0.7406021191091197.
[I 2024-01-07 12:54:54,148] Trial 2 finished with value: 0.738408820441295 and parameters: {'n_layers': 1, 'n_units_l0': 29, 'optimizer': 'SGD', 'lr': 0.0067630536036172705, 'batch_size': 64}. Best is trial 0 with value: 0.7406021191091197.
[I 2024-01-07 15:15:31,890] Trial 3 finished with value: 0.7365350485820203 and parameters: {'n_layers': 1, 'n_units_l0': 88, 'optimizer': 'Adam', 'lr': 0.00023497600347412566, 'batch_size': 256}. Best is trial 0 with value: 0.7406021191091197.
[I 2024-01-07 15:35:33,890] Trial 4 finished with value: 0.7288421797926433 and parameters: {'n_layers': 4, 'n_units_l0': 14, 'n_units_l1': 93, 'n_units_l2': 24, 'n_units_l3': 57, 'optimizer': 'Adam', 'lr': 0.021684412297480735, 'batch_size': 512}. Best is trial 0 with value: 0.7406021191091197.
[I 2024-01-07 16:58:51,663] Trial 5 finished with value: 0.7440909441595327 and parameters: {'n_layers': 4, 'n_units_l0': 128, 'n_units_l1': 60, 'n_units_l2': 23, 'n_units_l3': 65, 'optimizer': 'SGD', 'lr': 0.0011334592720515732, 'batch_size': 256}. Best is trial 5 with value: 0.7440909441595327.
[I 2024-01-07 17:16:52,946] Trial 6 finished with value: 0.7190301387527521 and parameters: {'n_layers': 2, 'n_units_l0': 118, 'n_units_l1': 87, 'optimizer': 'SGD', 'lr': 0.020436902131702975, 'batch_size': 128}. Best is trial 5 with value: 0.7440909441595327.
[I 2024-01-07 18:33:08,581] Trial 7 finished with value: 0.727039078656437 and parameters: {'n_layers': 3, 'n_units_l0': 71, 'n_units_l1': 77, 'n_units_l2': 117, 'optimizer': 'SGD', 'lr': 0.007088302279699148, 'batch_size': 512}. Best is trial 5 with value: 0.7440909441595327.
[I 2024-01-07 19:56:25,634] Trial 8 finished with value: 0.7449847689213417 and parameters: {'n_layers': 4, 'n_units_l0': 61, 'n_units_l1': 8, 'n_units_l2': 71, 'n_units_l3': 105, 'optimizer': 'Adam', 'lr': 0.0012495236781686911, 'batch_size': 512}. Best is trial 8 with value: 0.7449847689213417.
[I 2024-01-07 21:08:48,496] Trial 9 finished with value: 0.7459190503490223 and parameters: {'n_layers': 3, 'n_units_l0': 108, 'n_units_l1': 82, 'n_units_l2': 48, 'optimizer': 'Adam', 'lr': 0.00043361196380463726, 'batch_size': 128}. Best is trial 9 with value: 0.7459190503490223.
[I 2024-01-07 23:51:40,142] Trial 10 finished with value: 0.7441264861361722 and parameters: {'n_layers': 3, 'n_units_l0': 99, 'n_units_l1': 123, 'n_units_l2': 68, 'optimizer': 'Adam', 'lr': 0.00012039465109011707, 'batch_size': 128}. Best is trial 9 with value: 0.7459190503490223.
Number of finished trials:  11
Best trial:
  NDCG@5: 0.7459190503490223
  Params: 
    n_layers: 3
    n_units_l0: 108
    n_units_l1: 82
    n_units_l2: 48
    optimizer: Adam
    lr: 0.00043361196380463726
    batch_size: 128
