[I 2024-01-07 10:43:51,448] A new study created in memory with name: no-name-9d75fd96-02a2-47fd-ab08-d99109145a86
[I 2024-01-07 12:05:56,015] Trial 0 finished with value: 0.7409923748447184 and parameters: {'n_layers': 3, 'n_units_l0': 12, 'n_units_l1': 43, 'n_units_l2': 68, 'optimizer': 'Adam', 'lr': 0.0004173049270069019, 'batch_size': 256}. Best is trial 0 with value: 0.7409923748447184.
[I 2024-01-07 12:48:51,352] Trial 1 finished with value: 0.7393923734014046 and parameters: {'n_layers': 3, 'n_units_l0': 6, 'n_units_l1': 121, 'n_units_l2': 103, 'optimizer': 'SGD', 'lr': 0.0005716115621831492, 'batch_size': 64}. Best is trial 0 with value: 0.7409923748447184.
[I 2024-01-07 13:29:58,543] Trial 2 finished with value: 0.731391646000061 and parameters: {'n_layers': 2, 'n_units_l0': 11, 'n_units_l1': 83, 'optimizer': 'SGD', 'lr': 0.00399894860015277, 'batch_size': 256}. Best is trial 0 with value: 0.7409923748447184.
[I 2024-01-07 14:58:06,575] Trial 3 finished with value: 0.7471607098265111 and parameters: {'n_layers': 3, 'n_units_l0': 51, 'n_units_l1': 46, 'n_units_l2': 16, 'optimizer': 'SGD', 'lr': 0.00042307020966057845, 'batch_size': 64}. Best is trial 3 with value: 0.7471607098265111.
[I 2024-01-07 16:54:53,314] Trial 4 finished with value: 0.74436640429417 and parameters: {'n_layers': 2, 'n_units_l0': 30, 'n_units_l1': 107, 'optimizer': 'Adam', 'lr': 0.0008567189455158406, 'batch_size': 512}. Best is trial 3 with value: 0.7471607098265111.
[I 2024-01-07 17:31:18,540] Trial 5 finished with value: 0.7209091754087021 and parameters: {'n_layers': 2, 'n_units_l0': 62, 'n_units_l1': 76, 'optimizer': 'Adam', 'lr': 0.01598274917569839, 'batch_size': 128}. Best is trial 3 with value: 0.7471607098265111.
[I 2024-01-07 19:25:37,699] Trial 6 finished with value: 0.7470858797197084 and parameters: {'n_layers': 4, 'n_units_l0': 71, 'n_units_l1': 87, 'n_units_l2': 68, 'n_units_l3': 29, 'optimizer': 'SGD', 'lr': 0.0011080930614294363, 'batch_size': 128}. Best is trial 3 with value: 0.7471607098265111.
[I 2024-01-07 22:08:41,069] Trial 7 finished with value: 0.7464954895119024 and parameters: {'n_layers': 4, 'n_units_l0': 99, 'n_units_l1': 109, 'n_units_l2': 52, 'n_units_l3': 17, 'optimizer': 'Adam', 'lr': 0.00016998771085444033, 'batch_size': 64}. Best is trial 3 with value: 0.7471607098265111.
[I 2024-01-07 22:59:58,633] Trial 8 finished with value: 0.7210786414093759 and parameters: {'n_layers': 3, 'n_units_l0': 53, 'n_units_l1': 81, 'n_units_l2': 25, 'optimizer': 'SGD', 'lr': 0.010871698370978821, 'batch_size': 512}. Best is trial 3 with value: 0.7471607098265111.
Number of finished trials:  9
Best trial:
  NDCG@5: 0.7471607098265111
  Params: 
    n_layers: 3
    n_units_l0: 51
    n_units_l1: 46
    n_units_l2: 16
    optimizer: SGD
    lr: 0.00042307020966057845
    batch_size: 64
